{
  "authority_id": "mca-statistical-compatibility-authority",
  "authority_version": "1.0",
  "schema_version": "1.0",
  "extraction_method": {
    "id": "mca-semantic-authority-extraction",
    "version": "1.0",
    "documentation": "docs/statistical-compatibility.md"
  },
  "classifications": [
    "no_normative_impact",
    "compatible_without_historical_result_change",
    "compatible_contract_extension",
    "normative_result_change",
    "replay_incompatibility",
    "pseudo_random_stream_change",
    "serialized_shape_change",
    "migration_required",
    "invalidation_required",
    "decision_missing",
    "version_not_incremented",
    "corpus_or_proof_not_updated",
    "compatibility_control_error"
  ],
  "historical_treatments": [
    "compatible_without_action",
    "deterministic_migration",
    "legacy_read_only_without_replay",
    "invalidation",
    "purge",
    "archival_with_previous_version",
    "explicit_rejection"
  ],
  "historical_data_categories": [
    "backend_history",
    "local_history",
    "runtime_caches",
    "reports_and_exports",
    "generated_proofs",
    "seeded_results",
    "replay_artifacts"
  ],
  "normative_surfaces": [
    "input_validation_and_normalization",
    "resolved_defaults",
    "seed_domain_and_resolution",
    "prng_algorithm",
    "draw_to_index_conversion",
    "logical_draw_order",
    "batching_behavior",
    "simulation_modes_and_stop_conditions",
    "censorship",
    "percentiles_p50_p70_p90",
    "risk_score",
    "reliability_metrics_and_labels",
    "histograms",
    "canonical_response_shape",
    "field_presence_and_absence",
    "result_serialization",
    "corpus_schema",
    "corpus_expected_results",
    "validation_probes",
    "exact_replay_protocol",
    "distributional_parity_protocol",
    "persisted_results_and_history",
    "caches_exports_and_replay_artifacts"
  ],
  "proof_artifacts": [
    {
      "id": "reference-corpus",
      "path": "contracts/statistical-reference-corpus-v1.0.json",
      "schema_path": "contracts/statistical-reference-corpus-v1.0.schema.json",
      "version": "1.0",
      "semantic_fingerprint": "8d448e6169832d663d460c31b6ed0fe027fb4ae95904212d16aadb418ebc3d28",
      "version_bindings": [
        { "pointer": "/schema_version", "expected": "1.0" },
        { "pointer": "/normative_contract/version", "expected": "1.0" },
        { "pointer": "/prng_contract/id", "expected": "mca-prng-v1" }
      ]
    },
    {
      "id": "validation-probes",
      "path": "contracts/statistical-validation-probes-v1.0.json",
      "schema_path": "contracts/statistical-validation-probes-v1.0.schema.json",
      "version": "1.1",
      "semantic_fingerprint": "edaae666e21023b39eb5a3fd0de5c0d2932d996672b56a3b561172ddbdd3f542",
      "version_bindings": [
        { "pointer": "/schema_version", "expected": "1.0" },
        { "pointer": "/normative_contract", "expected": "STD-STAT-001" }
      ]
    },
    {
      "id": "deterministic-parity",
      "path": "reports/statistical-parity-report.json",
      "schema_path": "contracts/statistical-parity-report-v1.1.schema.json",
      "version": "1.2",
      "semantic_fingerprint": "9c03522244da4eddae86beaa7e068db9af6220e1fa159b4dfcb00c8cee3afc04",
      "version_bindings": [
        { "pointer": "/report_version", "expected": "1.1" },
        { "pointer": "/corpus/schema_version", "expected": "1.0" },
        { "pointer": "/corpus/prng_contract", "expected": "mca-prng-v1" }
      ]
    },
    {
      "id": "exact-replay",
      "path": "reports/statistical-exact-replay-evidence.json",
      "schema_path": "contracts/statistical-exact-replay-evidence-v1.0.schema.json",
      "version": "1.0",
      "semantic_fingerprint": "ad881e25fbce9a26be3954824dc18ce81a62bc4b8f0c15b03b4d32c85f66f060",
      "version_bindings": [
        { "pointer": "/report_version", "expected": "1.0" },
        { "pointer": "/corpus/schema_version", "expected": "1.0" },
        { "pointer": "/corpus/normative_contract/version", "expected": "1.0" },
        { "pointer": "/corpus/prng_contract", "expected": "mca-prng-v1" }
      ]
    },
    {
      "id": "distribution-protocol",
      "path": "contracts/statistical-distribution-protocol-v1.0.json",
      "schema_path": "contracts/statistical-distribution-protocol-v1.0.schema.json",
      "version": "1.0",
      "semantic_fingerprint": "bec755f47ee8551b7a33fd36537df68b65e06c65b097f9c83cb1b0c02c1e94bd",
      "version_bindings": [
        { "pointer": "/version", "expected": "1.0" },
        { "pointer": "/authorities/corpus/version", "expected": "1.0" },
        { "pointer": "/authorities/normative_contract/version", "expected": "1.0" },
        { "pointer": "/authorities/prng/version", "expected": "1.0" }
      ]
    },
    {
      "id": "distribution-seeds",
      "path": "contracts/statistical-distribution-seeds-v1.0.json",
      "schema_path": "contracts/statistical-distribution-seeds-v1.0.schema.json",
      "version": "1.0",
      "semantic_fingerprint": "6df0a2ccea365b45569a7de66e9fbff9b34ebdace0cad516fc54ade03b694d5d",
      "version_bindings": [{ "pointer": "/version", "expected": "1.0" }]
    },
    {
      "id": "distribution-calibration",
      "path": "reports/statistical-distribution-calibration.json",
      "schema_path": "contracts/statistical-distribution-calibration-v1.0.schema.json",
      "version": "1.0",
      "semantic_fingerprint": "f86f31835498f8858420ae1853a13fd9d8e1a5c4b28e03cb5f44441804108c45",
      "version_bindings": [
        { "pointer": "/calibration_version", "expected": "1.0" },
        { "pointer": "/protocol/version", "expected": "1.0" }
      ]
    },
    {
      "id": "distribution-evidence",
      "path": "reports/statistical-distribution-evidence.json",
      "schema_path": "contracts/statistical-distribution-evidence-v1.0.schema.json",
      "version": "1.0",
      "semantic_fingerprint": "65d64ad9ae7bd1026c2c2c40d362f5654a1d1a22c8e295da6970822c7a6da1bf",
      "version_bindings": [
        { "pointer": "/evidence_version", "expected": "1.0" },
        { "pointer": "/protocol/version", "expected": "1.0" },
        { "pointer": "/authorities/corpus/version", "expected": "1.0" },
        { "pointer": "/authorities/normative_contract/version", "expected": "1.0" },
        { "pointer": "/authorities/prng/id", "expected": "mca-prng-v1" }
      ]
    }
  ],
  "components": [
    {
      "id": "input-contract",
      "current_version": "1.0",
      "surfaces": ["input_validation_and_normalization"],
      "consumers": ["backend API", "Python engine", "TypeScript engine", "corpus runners"],
      "dependencies": [],
      "authorities": [
        { "path": "docs/standards/STD-STAT-001.md", "kind": "markdown_rules", "selectors": ["STAT-PAR-011", "STAT-PAR-012", "STAT-PAR-013", "STAT-PAR-014", "STAT-PAR-015", "STAT-PAR-016"] },
        { "path": "backend/simulation_limits.py", "kind": "python_ast", "selectors": ["SIMULATION_N_SIMS_MIN", "SIMULATION_N_SIMS_MAX", "SIMULATION_TARGET_WEEKS_MIN", "SIMULATION_HORIZON_WEEKS_MAX", "SIMULATION_THROUGHPUT_SAMPLES_MIN", "SIMULATION_THROUGHPUT_SAMPLES_MAX", "SIMULATION_BACKLOG_SIZE_MIN", "SIMULATION_BACKLOG_SIZE_MAX"] },
        { "path": "backend/simulation_value_objects.py", "kind": "python_ast", "selectors": ["_strict_integer", "_bounded_integer", "ThroughputSamples"] },
        { "path": "backend/simulation_models.py", "kind": "python_ast", "selectors": ["SimulationCommand"] },
        { "path": "frontend/src/domain/simulationValueObjects.ts", "kind": "typescript_declarations", "selectors": ["SIMULATION_N_SIMS_MIN", "SIMULATION_N_SIMS_MAX", "SIMULATION_TARGET_WEEKS_MIN", "SIMULATION_HORIZON_WEEKS_MAX", "SIMULATION_THROUGHPUT_SAMPLES_MIN", "SIMULATION_THROUGHPUT_SAMPLES_MAX", "SIMULATION_BACKLOG_SIZE_MIN", "SIMULATION_BACKLOG_SIZE_MAX", "strictInteger", "boundedInteger", "validateRawThroughput", "createThroughputSamples"] },
        { "path": "frontend/src/domain/simulation.ts", "kind": "typescript_declarations", "selectors": ["COMMAND_INPUT_KEYS", "NORMALIZED_COMMON_KEYS", "NORMALIZED_ALLOWED_KEYS", "createSimulationCommand", "createSimulationCommandFromNormalizedInput"] },
        { "path": "contracts/statistical-reference-corpus-v1.0.schema.json", "kind": "json_semantic", "selectors": ["/$defs/normalizedInput", "/$defs/throughputSamples", "/$defs/simulationCount"] }
      ],
      "required_proofs": ["validation-probes", "deterministic-parity", "exact-replay"],
      "affected_data": ["replay_artifacts"],
      "default_drift_classification": "normative_result_change",
      "releases": [{
        "version": "1.0", "identity": "STD-STAT-001-input-contract", "semantic_fingerprint": "5f8e4db976d08aa8c3cc374035846d42f862150199f237964f97aaa4e3d7db07",
        "decision": { "id": "PBI-2.20-baseline-input-contract", "status": "accepted", "classification": "compatible_without_historical_result_change", "from_version": null, "to_version": "1.0", "from_fingerprint": null, "to_fingerprint": "5f8e4db976d08aa8c3cc374035846d42f862150199f237964f97aaa4e3d7db07", "changed_surfaces": [], "rationale": "Initial semantic baseline adopted without changing any statistical behavior.", "traceability": ["docs/statistical-compatibility.md"], "proof_artifacts": ["validation-probes", "deterministic-parity", "exact-replay"], "data_treatments": [{ "category": "replay_artifacts", "treatment": "compatible_without_action", "rationale": "The baseline records current behavior and does not alter existing replay artifacts.", "evidence": ["reports/statistical-exact-replay-evidence.json"] }] }
      }]
    },
    {
      "id": "resolved-defaults",
      "current_version": "1.1",
      "surfaces": ["resolved_defaults"],
      "consumers": ["backend API", "frontend TeamForecast application", "normalized engine command"],
      "dependencies": [{ "component": "input-contract", "version": "1.0" }],
      "authorities": [